{
  "agency": "Department of the Treasury (Internal Revenue Code)",
  "blockers": [
    "Requires an act of Congress"
  ],
  "chapter": "27",
  "confidence": 58,
  "confidence_label": "medium",
  "confidence_reason": "Bill text read on GovInfo; absence of an enacted change checked against a secondary Code publication.",
  "durability": {
    "level": "high",
    "why": "A statute would be durable if enacted."
  },
  "est_completion": {
    "basis": "Inference: the only related bill found is in committee and takes a different approach.",
    "window": "unlikely this term"
  },
  "headline": false,
  "history": [
    {
      "date": "2026-10-14",
      "note": "Added in the layer 3 enumeration pass; researched and sent to independent review."
    },
    {
      "date": "2026-10-14",
      "note": "Independent review: proposed 6 (parallel) confirmed; bill re-sourced to GovInfo; confidence 58."
    },
    {
      "date": "2026-10-14",
      "note": "Significance scored blind by two AI raters from the recommendation text only; the two agreed within the adjudication threshold, so no third rater was needed."
    }
  ],
  "id": "c27-16",
  "last_checked": "2026-10-14",
  "layer": 3,
  "match": "parallel",
  "mechanism": "legislation",
  "pages": [
    831
  ],
  "position": "Entrepreneurial Capital Formation",
  "progress": 6,
  "proposal": "The Mandate recommends that Congress amend the Internal Revenue Code so that crowdfunding and Regulation A shareholders do not count toward the 100-shareholder limit for Subchapter S corporations.",
  "related_ids": [
    "c27-04"
  ],
  "remaining": [
    "Exclusion of crowdfunding and Regulation A holders from the count",
    "Enactment of any change to the shareholder limit"
  ],
  "requires_congress": "yes",
  "research_agent": "N27",
  "restates_ids": [],
  "review": {
    "flags": [
      "Replaced the tracker source for S. 1371 with the GovInfo bill text",
      "Replaced the undated law-firm tax summary with the Code text as published by Cornell LII"
    ],
    "mandate_check": "confirmed",
    "mandate_note": "Page 831, Entrepreneurial Capital Formation (Congress bullet): amend the IRC to disregard crowdfunding and Regulation A shareholders for the 100-shareholder S corporation limit. Paraphrase accurate.",
    "model": "Claude Opus",
    "reviewed_at": "2026-10-14",
    "reviewer": "Y2",
    "source_checks": [
      {
        "note": "S. 1371 introduced 2025-04-09 by Sen. Boozman, referred to Finance; strikes 100 and inserts 250 in 1361(b)(1)(A) for taxable years after 2025-12-31; no mention of crowdfunding or Regulation A. Checked 2026-10-14.",
        "result": "supports",
        "url": "https://www.govinfo.gov/content/pkg/BILLS-119s1371is/html/BILLS-119s1371is.htm"
      },
      {
        "note": "Section 1361(b)(1)(A) still reads 100 shareholders; latest listed amendment 2018; no crowdfunding or Regulation A provision. Checked 2026-10-14.",
        "result": "supports",
        "url": "https://www.law.cornell.edu/uscode/text/26/1361"
      }
    ]
  },
  "significance": {
    "B": 1,
    "F": 1,
    "F_estimated": true,
    "M": 1,
    "R": 1,
    "adjudicated": false,
    "rater_scores": [
      {
        "B": 1,
        "F": 1,
        "M": 1,
        "R": 1,
        "rater": "A"
      },
      {
        "B": 1,
        "F": 1,
        "M": 1,
        "R": 1,
        "rater": "B"
      }
    ],
    "raters": 2,
    "rationale": "Would exclude crowdfunding and Regulation A holders from the S corporation 100-shareholder limit, a narrow procedural tax change for few firms.",
    "version": "2026-10-14",
    "weight": 1
  },
  "sources": [
    {
      "date": "2025-04-09",
      "kind": "primary",
      "publisher": "GovInfo",
      "title": "S. 1371, S-CAP Act of 2025, as introduced",
      "url": "https://www.govinfo.gov/content/pkg/BILLS-119s1371is/html/BILLS-119s1371is.htm"
    },
    {
      "date": "undated",
      "kind": "news",
      "publisher": "Legal Information Institute, Cornell Law School",
      "title": "26 U.S. Code 1361, S corporation defined",
      "url": "https://www.law.cornell.edu/uscode/text/26/1361"
    }
  ],
  "stage": "proposed",
  "status_summary": "S. 1371, the S-CAP Act of 2025 (Sen. Boozman, introduced 2025-04-09, referred to the Finance Committee), would raise the S corporation shareholder limit in IRC section 1361(b)(1)(A) from 100 to 250 for taxable years beginning after 2025; it does not mention crowdfunding or Regulation A shareholders, so it is a different approach to the same constraint. The section as published by Cornell's Legal Information Institute still sets the limit at 100 and lists no 2025 amendment.",
  "timeline": [
    {
      "date": "2025-04-09",
      "event": "S. 1371 was introduced to raise the S corporation shareholder limit from 100 to 250 and referred to the Senate Finance Committee.",
      "kind": "primary",
      "source": "GovInfo",
      "url": "https://www.govinfo.gov/content/pkg/BILLS-119s1371is/html/BILLS-119s1371is.htm"
    }
  ],
  "title": "Disregard crowdfunding and Regulation A holders in the S corporation shareholder limit",
  "tracked": true,
  "uncertainties": "Later actions on S. 1371 were not checked on congress.gov. The current text of section 1361 was read on the Legal Information Institute site, which may lag recent amendments; no CRS or JCT summary of Public Law 119-21 was opened, so absence of a change in that law is not fully confirmed. A bill specific to crowdfunding or Regulation A shareholders may exist. Staging an introduced bill with a different approach as proposed parallel is a judgment call; not_started is defensible.",
  "updated_at": "2026-10-14"
}
