{
  "agency": "FinCEN",
  "blockers": [
    "Requires legislation for the data mandates"
  ],
  "chapter": "22",
  "confidence": 60,
  "confidence_label": "medium",
  "confidence_reason": "Mandate text checked; the proposed rule read in full on the Federal Register and the reported bill confirmed through CBO; the match is partial.",
  "durability": {
    "level": "medium",
    "why": "Rules can be reversed; a statutory mandate would last longer."
  },
  "est_completion": {
    "basis": "Inference: one bill with a narrower reporting duty was reported by committee; no floor action was found.",
    "window": "unknown"
  },
  "headline": false,
  "history": [
    {
      "date": "2026-10-13",
      "note": "Added in the layer 3 enumeration pass; researched and sent to independent review."
    },
    {
      "date": "2026-10-13",
      "note": "Independent review: H.R. 1602 added, progress 10 to 12, proposed confirmed, confidence 60."
    },
    {
      "date": "2026-10-13",
      "note": "Significance scored blind by two AI raters from the recommendation text only."
    }
  ],
  "id": "c22-17",
  "last_checked": "2026-10-13",
  "layer": 3,
  "match": "parallel",
  "mechanism": "legislation",
  "pages": [
    706,
    707
  ],
  "position": "Anti-Money Laundering and Beneficial Ownership Reporting Reform",
  "progress": 12,
  "proposal": "The Mandate recommends that Congress require FinCEN to publish annual data on suspicious activity and currency transaction reports, prosecutions, convictions, fines and compliance costs. It also recommends separate evaluations by FinCEN and GAO of which anti-money laundering measures work, and a public retrospective review of FinCEN regulations.",
  "related_ids": [
    "c22-05"
  ],
  "remaining": [
    "Statutory annual public data on reports, prosecutions, convictions, fines and compliance costs",
    "FinCEN and GAO effectiveness evaluations",
    "A public retrospective review of FinCEN regulations"
  ],
  "requires_congress": "yes",
  "research_agent": "N22",
  "restates_ids": [],
  "review": {
    "flags": [
      "judgment call: proposed 12 on a committee-reported bill with a narrower reporting duty; not_started (0) is defensible because the bill covers only a congressional SAR count and the proposed rule is parallel",
      "Added H.R. 1602 as the closest legislative match"
    ],
    "mandate_check": "confirmed",
    "mandate_note": "Pages 706-707, Anti-Money Laundering: Congress should require FinCEN to publish annual data on SARs, CTRs, prosecutions, convictions, fines and private costs; require separate FinCEN and GAO evaluations; and require a public retrospective review of FinCEN regulations. Paraphrase accurate.",
    "model": "Claude Opus",
    "reviewed_at": "2026-10-13",
    "reviewer": "Y22i",
    "source_checks": [
      {
        "note": "CBO estimate 2025-03-31; H.R. 1602 reported 2025-03-21; annual SAR report to Congress only; found by web search.",
        "result": "partial",
        "url": "https://www.cbo.gov/publication/61280"
      },
      {
        "note": "Proposed rule published 2026-04-10, comments closed 2026-06-09; cites EO 14192; full text read in two passes with no data publication, GAO or retrospective review provision.",
        "result": "partial",
        "url": "https://www.federalregister.gov/documents/2026/04/10/2026-07033/anti-money-laundering-and-countering-the-financing-of-terrorism-programs"
      },
      {
        "note": "Dated 2026-06-26; letter sent 2026-06-09 by committee and subcommittee chairs.",
        "result": "supports",
        "url": "https://infobytes.orrick.com/2026-06-26/house-financial-services-committee-republicans-urge-fincen-to-finalize-bsa-rule-with-reduced-compliance-burdens/"
      }
    ]
  },
  "significance": {
    "B": 1,
    "F": 1,
    "F_estimated": true,
    "M": 1,
    "R": 1,
    "adjudicated": false,
    "rater_scores": [
      {
        "B": 1,
        "F": 1,
        "M": 1,
        "R": 1,
        "rater": "A"
      },
      {
        "B": 1,
        "F": 1,
        "M": 1,
        "R": 1,
        "rater": "B"
      }
    ],
    "raters": 2,
    "rationale": "FinCEN would publish annual data on reports, prosecutions and compliance costs, and FinCEN and GAO would evaluate which anti-money laundering measures work.",
    "version": "2026-10-13",
    "weight": 1
  },
  "sources": [
    {
      "date": "2025-03-31",
      "kind": "primary",
      "publisher": "Congressional Budget Office",
      "title": "Cost estimate for H.R. 1602, Financial Privacy Act of 2025",
      "url": "https://www.cbo.gov/publication/61280"
    },
    {
      "date": "2026-04-10",
      "kind": "primary",
      "publisher": "Federal Register",
      "title": "Anti-Money Laundering and Countering the Financing of Terrorism Programs (proposed rule)",
      "url": "https://www.federalregister.gov/documents/2026/04/10/2026-07033/anti-money-laundering-and-countering-the-financing-of-terrorism-programs"
    },
    {
      "date": "2026-06-26",
      "kind": "news",
      "publisher": "Orrick",
      "title": "House Financial Services Committee Republicans urge FinCEN to finalize BSA rule with reduced compliance burdens",
      "url": "https://infobytes.orrick.com/2026-06-26/house-financial-services-committee-republicans-urge-fincen-to-finalize-bsa-rule-with-reduced-compliance-burdens/"
    }
  ],
  "stage": "proposed",
  "status_summary": "H.R. 1602, the Financial Privacy Act of 2025, was reported by the House Financial Services Committee on 2025-03-21; per the CBO estimate of 2025-03-31 it would require FinCEN to report annually to Congress on the number and types of suspicious activity reports, a narrower step than the public data on reports, prosecutions, fines and costs the chapter asks for. FinCEN published a proposed rule on anti-money laundering programs on 2026-04-10, citing Executive Order 14192 and aiming to reduce compliance burdens; it does not require the annual data, the FinCEN and GAO evaluations, or the retrospective review the chapter describes. Committee leaders urged FinCEN on 2026-06-09 to finalize that rule with reduced burdens.",
  "timeline": [
    {
      "date": "2025-03-21",
      "event": "The House Financial Services Committee reported H.R. 1602, which would require FinCEN to report annually to Congress on the number and types of suspicious activity reports (CBO estimate dated 2025-03-31).",
      "kind": "primary",
      "source": "Congressional Budget Office",
      "url": "https://www.cbo.gov/publication/61280"
    },
    {
      "date": "2026-04-10",
      "event": "FinCEN published a proposed rule reforming anti-money laundering program requirements and citing regulatory burden reduction.",
      "kind": "primary",
      "source": "Federal Register",
      "url": "https://www.federalregister.gov/documents/2026/04/10/2026-07033/anti-money-laundering-and-countering-the-financing-of-terrorism-programs"
    },
    {
      "date": "2026-06-09",
      "event": "House Financial Services Committee Republican leaders sent FinCEN a letter urging a final rule with reduced compliance burdens and higher report filing thresholds (reported 2026-06-26).",
      "kind": "news",
      "source": "Orrick",
      "url": "https://infobytes.orrick.com/2026-06-26/house-financial-services-committee-republicans-urge-fincen-to-finalize-bsa-rule-with-reduced-compliance-burdens/"
    }
  ],
  "title": "Publish annual AML data and require a retrospective review of FinCEN rules",
  "tracked": true,
  "uncertainties": "The H.R. 1602 provisions come from the CBO description, not the bill text, and later floor action was not checked. The proposed rule was read in full through two passes and contains no data publication or retrospective review requirement. The FinCEN SAR statistics page prints no date and was not treated as evidence. A letter from legislators is listed because it was a dated official act, though it does not advance the specific items.",
  "updated_at": "2026-10-13"
}
