{
  "agency": "EPA",
  "blockers": [],
  "chapter": "13",
  "confidence": 92,
  "confidence_label": "high",
  "confidence_reason": "Document text checked and both stage-deciding primary documents (the public law on govinfo and the Federal Register rule) were read.",
  "durability": {
    "level": "high",
    "why": "A Congressional Review Act disapproval bars a substantially similar rule absent new congressional authorization; reversing would need statute or a materially different rule."
  },
  "est_completion": {
    "basis": "Inference: both the disapproval law and the implementing rule are in effect.",
    "window": "done"
  },
  "headline": false,
  "history": [
    {
      "date": "2026-10-13",
      "note": "Added in the layer 3 enumeration pass; researched and sent to independent review."
    },
    {
      "date": "2026-10-13",
      "note": "Independent review: page and paraphrase confirmed; Public Law 119-20 (S.J. Res. 31, approved 2025-06-20) confirmed on govinfo; the 2026-01-02 rule restoring the 2020 text confirmed on federalregister.gov; completed 100 confirmed."
    },
    {
      "date": "2026-10-13",
      "note": "Significance scored blind by two AI raters from the recommendation text only."
    },
    {
      "date": "2026-10-15",
      "note": "Cross-reference added to the layer 3 second-pass record(s) c13-23 written in the 2026-10-15 enumeration run."
    }
  ],
  "id": "c13-14",
  "last_checked": "2026-10-15",
  "layer": 3,
  "match": "direct",
  "mechanism": "mixed",
  "pages": [
    426
  ],
  "position": "Office of Air and Radiation: Air Permitting Reforms for New Source Review and Title V",
  "progress": 100,
  "proposal": "The Mandate recommends restoring the Trump-era position on the Once-In, Always-In policy, under which a major source of hazardous air pollutants can become an area source once the relevant emission standards are met.",
  "related_ids": [
    "c13-03",
    "c13-23"
  ],
  "remaining": [],
  "requires_congress": "no",
  "research_agent": "N13",
  "review": {
    "flags": [],
    "mandate_check": "verified",
    "mandate_note": "Page 426 checked; the once-in, always-in recommendation is accurately paraphrased.",
    "model": "Claude Opus",
    "reviewed_at": "2026-10-13",
    "reviewer": "Y13a",
    "source_checks": [
      {
        "note": "Public Law 119-20, S.J. Res. 31, approved 2025-06-20, disapproves the rule at 89 FR 73293 (2024-09-10) on reclassification of major sources as area sources.",
        "result": "supports",
        "url": "https://www.govinfo.gov/content/pkg/PLAW-119publ20/html/PLAW-119publ20.htm"
      },
      {
        "note": "Final rule 91 FR 58, published and effective 2026-01-02, removes the 2024 amendments and restores the 2020 reclassification rule text.",
        "result": "supports",
        "url": "https://www.federalregister.gov/documents/2026/01/02/2025-24202/congressional-review-act-revocation-of-2024-review-of-final-rule-reclassification-of-major-sources"
      }
    ]
  },
  "self_confidence": 88,
  "significance": {
    "B": 1,
    "F": 1,
    "F_estimated": true,
    "M": 1,
    "R": 1,
    "adjudicated": false,
    "rater_scores": [
      {
        "B": 1,
        "F": 1,
        "M": 1,
        "R": 1,
        "rater": "A"
      },
      {
        "B": 1,
        "F": 1,
        "M": 1,
        "R": 1,
        "rater": "B"
      }
    ],
    "raters": 2,
    "rationale": "Restore the Trump-era Once-In, Always-In policy letting major hazardous pollutant sources reclassify as area sources.",
    "version": "2026-10-13",
    "weight": 1
  },
  "sources": [
    {
      "date": "2026-01-02",
      "kind": "primary",
      "publisher": "Federal Register",
      "title": "Congressional Review Act Revocation of 2024 Review of Final Rule Reclassification of Major Sources as Area Sources Under Section 112",
      "url": "https://www.federalregister.gov/documents/2026/01/02/2025-24202/congressional-review-act-revocation-of-2024-review-of-final-rule-reclassification-of-major-sources"
    },
    {
      "date": "2025-06-20",
      "kind": "primary",
      "publisher": "govinfo",
      "title": "Public Law 119-20 (S.J. Res. 31)",
      "url": "https://www.govinfo.gov/content/pkg/PLAW-119publ20/html/PLAW-119publ20.htm"
    }
  ],
  "stage": "completed",
  "status_summary": "Public Law 119-20 (S.J. Res. 31), approved 2025-06-20, disapproved EPA's September 2024 rule that had required certain reclassified sources to keep meeting major source standards, and it has no force or effect. EPA then published a rule on 2026-01-02, effective the same day, that removes the 2024 amendments and restores the text of the 2020 reclassification rule. Under the Congressional Review Act a substantially similar rule cannot be reissued without new statutory authority.",
  "timeline": [
    {
      "date": "2025-06-20",
      "event": "Public Law 119-20 (S.J. Res. 31) became law, disapproving EPA's 2024 rule on reclassification of major sources as area sources.",
      "kind": "primary",
      "source": "govinfo",
      "url": "https://www.govinfo.gov/content/pkg/PLAW-119publ20/html/PLAW-119publ20.htm"
    },
    {
      "date": "2026-01-02",
      "event": "EPA published and made effective a rule removing the 2024 amendments and restoring the 2020 reclassification text.",
      "kind": "primary",
      "source": "Federal Register",
      "url": "https://www.federalregister.gov/documents/2026/01/02/2025-24202/congressional-review-act-revocation-of-2024-review-of-final-rule-reclassification-of-major-sources"
    }
  ],
  "title": "Restore the 2020 policy letting major sources reclassify to area source status",
  "tracked": true,
  "uncertainties": "The record does not cover the other permitting items in the same section of the document, such as potential-to-emit assumptions or Title V petition standards.",
  "updated_at": "2026-10-15"
}
