{
  "agency": "EPA",
  "blockers": [
    "Rulemaking not finalized",
    "Likely litigation by safety and community groups"
  ],
  "chapter": "13",
  "confidence": 80,
  "confidence_label": "high",
  "confidence_reason": "Document text checked and the stage-deciding proposed rule and comment extension were read on federalregister.gov.",
  "durability": {
    "level": "medium",
    "why": "A final rule would be reviewable in court and reversible by later rulemaking."
  },
  "est_completion": {
    "basis": "Inference: the comment period closed in May 2026 and no final rule had appeared by October 2026; final action within about a year of proposal is common but no schedule was found.",
    "window": "2027-H1"
  },
  "headline": false,
  "history": [
    {
      "date": "2026-10-13",
      "note": "Added in the layer 3 enumeration pass; researched and sent to independent review."
    },
    {
      "date": "2026-10-13",
      "note": "Independent review: page and paraphrase confirmed; proposal read on federalregister.gov; comment closing date corrected to 2026-05-11 after an extension; the claim about dropping on-request information was softened; stage proposed 20 confirmed."
    },
    {
      "date": "2026-10-13",
      "note": "Significance scored blind by two AI raters from the recommendation text only."
    },
    {
      "date": "2026-10-15",
      "note": "Cross-reference added to the layer 3 second-pass record(s) c13-29 written in the 2026-10-15 enumeration run."
    }
  ],
  "id": "c13-17",
  "last_checked": "2026-10-15",
  "layer": 3,
  "match": "direct",
  "mechanism": "agency_rule",
  "pages": [
    432
  ],
  "position": "Office of Land and Emergency Management: Risk Management Program",
  "progress": 20,
  "proposal": "The Mandate recommends that, if the previous administration finalizes a new Risk Management Program rule under Clean Air Act section 112(r), EPA revise it to reflect the 2019 amendments that protect sensitive information.",
  "related_ids": [
    "c13-29"
  ],
  "remaining": [
    "Finalize the rule after comments",
    "Decide between rescinding and narrowing third-party audits"
  ],
  "requires_congress": "no",
  "research_agent": "N13",
  "review": {
    "flags": [],
    "mandate_check": "verified",
    "mandate_note": "Page 432 checked; the conditional recommendation to revise a new RMP rule toward the 2019 information protections is accurately paraphrased.",
    "model": "Claude Opus",
    "reviewed_at": "2026-10-13",
    "reviewer": "Y13a",
    "source_checks": [
      {
        "note": "Proposed rule 91 FR 8970: STAA rescission for existing processes, audit options, controlled county-level data tool, security balancing, 2019 rule reasoning, savings 234.7 to 241.9 million dollars a year; on-request provision not confirmed in parts read, so that claim was softened.",
        "result": "supports",
        "url": "https://www.federalregister.gov/documents/2026/02/24/2026-03633/accidental-release-prevention-requirements-risk-management-programs-under-the-clean-air-act-common"
      },
      {
        "note": "Comment period extended to 2026-05-11, so the earlier 2026-04-10 closing date was corrected.",
        "result": "supports",
        "url": "https://www.federalregister.gov/documents/2026/04/02/2026-06444/accidental-release-prevention-requirements-risk-management-programs-under-the-clean-air-act-common"
      },
      {
        "note": "Query: EPA, risk management programs accidental release, from 2025-01-20. Five results; no final rule.",
        "result": "supports",
        "url": "https://www.federalregister.gov/api/v1/documents.json"
      }
    ]
  },
  "self_confidence": 70,
  "significance": {
    "B": 1,
    "F": 1,
    "F_estimated": true,
    "M": 1,
    "R": 1,
    "adjudicated": false,
    "rater_scores": [
      {
        "B": 1,
        "F": 1,
        "M": 1,
        "R": 1,
        "rater": "A"
      },
      {
        "B": 1,
        "F": 1,
        "M": 1,
        "R": 1,
        "rater": "B"
      }
    ],
    "raters": 2,
    "rationale": "Revise any new Risk Management Program rule to reflect 2019 amendments protecting sensitive information.",
    "version": "2026-10-13",
    "weight": 1
  },
  "sources": [
    {
      "date": "2026-02-24",
      "kind": "primary",
      "publisher": "Federal Register",
      "title": "Accidental Release Prevention Requirements: Risk Management Programs Under the Clean Air Act; Common Sense Approach to Chemical Accident Prevention (proposed)",
      "url": "https://www.federalregister.gov/documents/2026/02/24/2026-03633/accidental-release-prevention-requirements-risk-management-programs-under-the-clean-air-act-common"
    },
    {
      "date": "2026-04-02",
      "kind": "primary",
      "publisher": "Federal Register",
      "title": "Accidental Release Prevention Requirements: Risk Management Programs Under the Clean Air Act; Common Sense Approach to Chemical Accident Prevention; Extension of Comment Period",
      "url": "https://www.federalregister.gov/documents/2026/04/02/2026-06444/accidental-release-prevention-requirements-risk-management-programs-under-the-clean-air-act-common"
    }
  ],
  "stage": "proposed",
  "status_summary": "The 2024 Safer Communities by Chemical Accident Prevention rule was finalized under the prior administration. On 2026-02-24 EPA published a proposed rule that would rescind certain 2024 provisions and modify others: it would remove safer technology and alternatives analysis requirements for existing processes, either rescind third-party audits or limit them to facilities with two or more accidents in five years, and keep the public data tool in a more controlled form limited to county-level searches without mapping, citing security concerns and drawing on the reasoning of the 2019 reconsideration rule. EPA estimated net annualized cost savings of about 235 to 242 million dollars. The comment period was extended to 2026-05-11, and no final rule was found in the Federal Register through 2026-10-13.",
  "timeline": [
    {
      "date": "2026-02-24",
      "event": "EPA published a proposed rule revising the 2024 Risk Management Program amendments, including information availability, third-party audits and safer technology analysis.",
      "kind": "primary",
      "source": "Federal Register",
      "url": "https://www.federalregister.gov/documents/2026/02/24/2026-03633/accidental-release-prevention-requirements-risk-management-programs-under-the-clean-air-act-common"
    },
    {
      "date": "2026-04-02",
      "event": "EPA extended the comment period on the proposal to 2026-05-11.",
      "kind": "primary",
      "source": "Federal Register",
      "url": "https://www.federalregister.gov/documents/2026/04/02/2026-06444/accidental-release-prevention-requirements-risk-management-programs-under-the-clean-air-act-common"
    }
  ],
  "title": "Revise the Risk Management Program rule and protect sensitive facility information",
  "tracked": true,
  "uncertainties": "The proposal was read in part (the document is long); whether it rescinds the 2024 on-request information provision specifically was not confirmed in the parts read. A Federal Register API search on 2026-10-13 found no final rule.",
  "updated_at": "2026-10-15"
}
