{
  "agency": "Department of Labor (ETA, Wage and Hour Division, Office of Foreign Labor Certification)",
  "blockers": [],
  "chapter": "18",
  "confidence": 64,
  "confidence_label": "medium",
  "confidence_reason": "Mandate text read; the Project Firewall release and both debarment lists were fetched and read in review; the Inspector General recommendations and any speed measure were not found.",
  "durability": {
    "level": "medium",
    "why": "Enforcement initiatives are discretionary, but debarment listings continue as routine program administration."
  },
  "est_completion": {
    "basis": "Inference: the initiative is active but the text's speedier-debarment element has no clear completion measure.",
    "window": "unknown"
  },
  "headline": false,
  "history": [
    {
      "date": "2026-10-15",
      "note": "Added in the layer 3 enumeration pass (second pass over leftover candidates); researched and sent to independent review."
    },
    {
      "date": "2026-10-15",
      "note": "Independent review: in_progress 30; Project Firewall and the debarment lists confirmed, progress lowered from 40 because speedier debarment and contract exclusion are not shown; confidence 64."
    },
    {
      "date": "2026-10-15",
      "note": "Significance scored blind by two AI raters from the recommendation text only; the two agreed within the adjudication threshold, so no third rater was needed."
    }
  ],
  "id": "c18-27",
  "last_checked": "2026-10-15",
  "layer": 3,
  "match": "partial",
  "mechanism": "agency_action",
  "pages": [
    613
  ],
  "position": "Secretary of Labor; Employment and Training Administration; Wage and Hour Division",
  "progress": 30,
  "proposal": "The Mandate states that businesses committing visa fraud should not benefit from federal spending, cites a 2020 DOL Inspector General report on weaknesses in the process for excluding abusers, and says DOL must follow the Inspector General's recommendations and institute more robust investigations for suspected visa fraud and faster debarments of those found guilty (p. 613).",
  "related_ids": [
    "c18-07",
    "c18-22"
  ],
  "remaining": [
    "Implementation of the 2020 Inspector General recommendations on the exclusion process (p. 613; not verified)",
    "Evidence that debarments are issued faster than before (p. 613; not measurable from the lists)",
    "Exclusion of debarred employers from federal contracts (p. 613; not checked)"
  ],
  "requires_congress": "no",
  "research_agent": "R1718",
  "restates_ids": [],
  "review": {
    "flags": [
      "Progress lowered from 40 to 30 within in_progress: the investigation initiative is operative, but speedier debarment, contract exclusion and the Inspector General recommendations are unshown. proposed 20 would also be defensible, since debarments are routine and predate the window.",
      "Timeline trimmed to the initiative and the latest debarment entry; the debarment-start entries are effects of orders rather than dated orders, so only one is kept as an illustration."
    ],
    "mandate_check": "confirmed",
    "mandate_note": "Page 613 says visa-fraud employers should not benefit from federal spending and asks DOL to follow the 2020 Inspector General recommendations and to institute more robust investigations of suspected visa fraud and speedier debarments.",
    "model": "Claude Opus",
    "reviewed_at": "2026-10-15",
    "reviewer": "Y3",
    "source_checks": [
      {
        "note": "Checked 2026-10-15: release of 2025-09-19 confirms Secretary-certified H-1B investigations and debarment as a sanction; no mention of the Inspector General, contract exclusion or speed.",
        "result": "partial",
        "url": "https://www.dol.gov/newsroom/releases/osec/osec20250919"
      },
      {
        "note": "Checked 2026-10-15: six H-1B entries, start dates 2025-05-12 to 2026-09-24; page last updated 2026-09-30.",
        "result": "supports",
        "url": "https://www.dol.gov/agencies/whd/immigration/h1b/debarment"
      },
      {
        "note": "Checked 2026-10-15: undated list of 54 entries with 2025 and 2026 start dates across PERM, H-2A and H-2B.",
        "result": "supports",
        "url": "https://www.dol.gov/sites/dolgov/files/ETA/oflc/pdfs/Debarment_List.pdf"
      }
    ]
  },
  "significance": {
    "B": 1,
    "F": 1,
    "F_estimated": true,
    "M": 1,
    "R": 1,
    "adjudicated": false,
    "rater_scores": [
      {
        "B": 1,
        "F": 1,
        "M": 1,
        "R": 1,
        "rater": "A"
      },
      {
        "B": 1,
        "F": 1,
        "M": 1,
        "R": 1,
        "rater": "B"
      }
    ],
    "raters": 2,
    "rationale": "Visa fraud debarment investigation improvements.",
    "version": "2026-10-15",
    "weight": 1
  },
  "sources": [
    {
      "date": "2025-09-19",
      "kind": "primary",
      "publisher": "Department of Labor",
      "title": "DOL news release on Project Firewall",
      "url": "https://www.dol.gov/newsroom/releases/osec/osec20250919"
    },
    {
      "date": "2026-09-30 (page last updated)",
      "kind": "primary",
      "publisher": "Department of Labor, Wage and Hour Division",
      "title": "H-1B Debarred/Disqualified List of Employers",
      "url": "https://www.dol.gov/agencies/whd/immigration/h1b/debarment"
    },
    {
      "date": "undated",
      "kind": "primary",
      "publisher": "Department of Labor, ETA OFLC",
      "title": "Permanent Labor Certification, H-2A and H-2B Debarment List",
      "url": "https://www.dol.gov/sites/dolgov/files/ETA/oflc/pdfs/Debarment_List.pdf"
    }
  ],
  "stage": "in_progress",
  "status_summary": "On 2025-09-19 DOL launched Project Firewall, an H-1B enforcement initiative under which the Secretary of Labor personally certifies the start of investigations where there is reasonable cause to suspect noncompliance, led by the Office of Immigration Policy, ETA and the Wage and Hour Division; violations can lead to back wages, civil penalties or debarment from the H-1B program. DOL debarment lists show H-1B debarments with periods beginning from 2025-05-12 to 2026-09-24 and dozens of H-2A, H-2B and permanent certification debarments beginning in 2025 and 2026. The lists do not show whether debarments became faster, the release does not mention exclusion from federal contracts, and action on the 2020 Inspector General recommendations was not found.",
  "timeline": [
    {
      "date": "2025-09-19",
      "event": "DOL announces Project Firewall: H-1B enforcement initiative with Secretary-certified investigations and possible debarment (Release No. 25-1476-NAT).",
      "kind": "primary",
      "source": "Department of Labor",
      "url": "https://www.dol.gov/newsroom/releases/osec/osec20250919"
    },
    {
      "date": "2026-09-24",
      "event": "H-1B debarment period begins for the latest of six entries on the Wage and Hour Division list (earliest start 2025-05-12); the page was last updated 2026-09-30.",
      "kind": "primary",
      "source": "Department of Labor, Wage and Hour Division",
      "url": "https://www.dol.gov/agencies/whd/immigration/h1b/debarment"
    }
  ],
  "title": "Step up visa fraud investigations and debarments of abusive foreign labor employers",
  "tracked": true,
  "uncertainties": "The release and both debarment lists were fetched and re-read in review. The OFLC list is undated and has 54 entries (2 permanent certification, 25 H-2A, 27 H-2B), with debarment start dates in 2025 and 2026; the start date of a debarment period is not necessarily the date of the final order, and the lists show only current debarments, so earlier periods cannot be compared to judge speed. The Inspector General's 2020 report and any DOL response were not located. A Federal Register API search of ETA documents for debarment returned no rules specific to debarment. Searches run: three WebSearches by the researcher (debarment announcements, Project Firewall, debarment list) and fetches; no WebSearch in review. Press coverage of H-1B debarments was seen in results but not cited. Project Firewall targets H-1B compliance generally, which overlaps with but is not the same as visa fraud.",
  "updated_at": "2026-10-15"
}
